{
  "schema_version": "tenant-document-grant-v1",
  "grant_id": "grant-tenant-a-ddia",
  "tenant_id": "tenant-a",
  "collection_id": "collection-a",
  "document_id": "book-foundations",
  "content_key": "sha256:aaaaaaaaaaaaaaaaaaaaaaaaaaaaaaaaaaaaaaaaaaaaaaaaaaaaaaaaaaaaaaaa.pipeline:bbbbbbbbbbbbbbbbbbbbbbbbbbbbbbbbbbbbbbbbbbbbbbbbbbbbbbbbbbbbbbbb",
  "display": { "filename": "systems-foundations.pdf", "title": "Systems Foundations" },
  "status": "active",
  "granted_at": "2026-08-02T09:01:00Z",
  "revoked_at": null
}
